{
  "contract_type": "factory.v2.verification",
  "contract_version": "1.0.0",
  "mission_id": "mission.demo",
  "candidate": {
    "candidate_id": "candidate-b",
    "source_revision": "2222222222222222222222222222222222222222",
    "artifact_hash": "sha256:cccccccccccccccccccccccccccccccccccccccccccccccccccccccccccccccc",
    "artifact_uri": "git+https://example.invalid/factory-v2@2222222"
  },
  "code_review": {
    "kind": "adversarial_code_security_invariant",
    "verdict": "PASS",
    "candidate": {
      "candidate_id": "candidate-b",
      "source_revision": "2222222222222222222222222222222222222222",
      "artifact_hash": "sha256:cccccccccccccccccccccccccccccccccccccccccccccccccccccccccccccccc",
      "artifact_uri": "git+https://example.invalid/factory-v2@2222222"
    },
    "verifier": {
      "identity": "antigravity:reviewer-1",
      "runtime": {
        "harness": "Antigravity",
        "version": "2026.09",
        "provenance_ref": {
          "kind": "review-run",
          "uri": "vault://evidence/review-pass.json",
          "revision": "2222222222222222222222222222222222222222",
          "content_hash": "sha256:dddddddddddddddddddddddddddddddddddddddddddddddddddddddddddddddd",
          "immutable": true
        }
      },
      "independence": {
        "independent_from_producer": true,
        "independent_from_candidate_author": true
      }
    },
    "evidence": [
      {
        "kind": "review-result",
        "uri": "vault://evidence/review-pass.json",
        "revision": "2222222222222222222222222222222222222222",
        "content_hash": "sha256:eeeeeeeeeeeeeeeeeeeeeeeeeeeeeeeeeeeeeeeeeeeeeeeeeeeeeeeeeeeeeeee",
        "immutable": true
      }
    ]
  },
  "qa_e2e": {
    "kind": "qa_regression_e2e",
    "verdict": "PASS",
    "candidate": {
      "candidate_id": "candidate-b",
      "source_revision": "2222222222222222222222222222222222222222",
      "artifact_hash": "sha256:cccccccccccccccccccccccccccccccccccccccccccccccccccccccccccccccc",
      "artifact_uri": "git+https://example.invalid/factory-v2@2222222"
    },
    "verifier": {
      "identity": "antigravity:qa-1",
      "runtime": {
        "harness": "Antigravity",
        "version": "2026.09",
        "provenance_ref": {
          "kind": "qa-run",
          "uri": "vault://evidence/qa-pass.json",
          "revision": "2222222222222222222222222222222222222222",
          "content_hash": "sha256:ffffffffffffffffffffffffffffffffffffffffffffffffffffffffffffffff",
          "immutable": true
        }
      },
      "independence": {
        "independent_from_producer": true,
        "independent_from_candidate_author": true
      }
    },
    "evidence": [
      {
        "kind": "qa-result",
        "uri": "vault://evidence/qa-pass.json",
        "revision": "2222222222222222222222222222222222222222",
        "content_hash": "sha256:1111111111111111111111111111111111111111111111111111111111111111",
        "immutable": true
      }
    ]
  },
  "result": "PASS",
  "blocking_defects": [],
  "evidence": [
    {
      "kind": "verification-summary",
      "uri": "vault://evidence/verification-pass.json",
      "revision": "2222222222222222222222222222222222222222",
      "content_hash": "sha256:2222222222222222222222222222222222222222222222222222222222222222",
      "immutable": true
    }
  ]
}
